{
  "$schema": "../module.schema.json",
  "Author": "SmartStore AG",
  "Group": "Shipping",
  "SystemName": "Smartstore.ShippingByWeight",
  "FriendlyName": "Shipping by weight",
  "Description": "Provides shipping methods with computation based on weight.",
  "Version": "5.0",
  "MinAppVersion": "5.0",
  "Order": 1,
  "ResourceRootKey": "Plugins.Shipping.ByWeight",
  "ProjectUrl": ""
}