{
  "$schema": "../module.schema.json",
  "Group": "Shipping",
  "SystemName": "Smartstore.Shipping",
  "FriendlyName": "Default Shipping Providers",
  "Description": "Provides shipping methods for fixed rate shipping and computation based on total.",
  "Version": "5.0",
  "MinAppVersion": "5.0",
  "Author": "SmartStore AG",
  "Order": 0,
  "ResourceRootKey": "Plugins.SmartStore.Shipping"
}