{
  "$schema": "../module.schema.json",
  "Group": "Security",
  "SystemName": "Smartstore.Facebook.Auth",
  "FriendlyName": "Facebook Authentication",
  "Description": "Enables login with Facebook account.",
  "Version": "5.0",
  "MinAppVersion": "5.0",
  "Author": "SmartStore AG",
  "Order": 1,
  "ResourceRootKey": "Plugins.ExternalAuth.Facebook",
  "PrivateReferences": [
    "Microsoft.AspNetCore.Authentication.Facebook"
  ]
}