{
  "$schema": "../module.schema.json",
  "Group": "Developer",
  "SystemName": "Smartstore.DevTools",
  "FriendlyName": "Smartstore Developer Tools (MiniProfiler and other goodies)",
  "Description": "",
  "Version": "5.0",
  "MinAppVersion": "5.0",
  "Author": "SmartStore AG",
  "Order": 1,
  "ResourceRootKey": "Plugins.Developer.DevTools",
  "PrivateReferences": [
    "MiniProfiler.Shared",
    "MiniProfiler.AspNetCore",
    "MiniProfiler.AspNetCore.Mvc",
    "MiniProfiler.EntityFrameworkCore"
  ]
}
